{
  "contract_name": "campaign_snapshot",
  "contract_version": "v1",
  "owner": "fort_island_operator",
  "refresh_cadence": "campaign_bound",
  "source_layers": [
    "event_layer",
    "derived_commercial_layer"
  ],
  "grain": "campaign_market_window",
  "date_range": {
    "start_date": "2026-04-01",
    "end_date": "2026-06-30"
  },
  "market": {
    "slug": "middlesex-county-ma",
    "name": "Middlesex County, MA"
  },
  "records": [
    {
      "market_slug": "middlesex-county-ma",
      "period_start": "2026-04-01",
      "period_end": "2026-04-13",
      "sale_events_30d": 173,
      "enrichment_completion_rate": 0.92,
      "source_mix": [
        {
          "source": "zillow",
          "source_coverage_share": 0.88
        },
        {
          "source": "redfin",
          "source_coverage_share": 0.12
        }
      ],
      "campaign_readiness_note": "Activity volume and enrichment completion support a live spring campaign narrative."
    }
  ]
}
